{
  "schema_version": "v2.1.1",
  "run_id": "123e4567-e89b-72d3-a456-426614174000",
  "source_id": "SRC01",
  "created_at": "2026-03-05T12:51:06.071229+00:00",
  "definitions": [
    {
      "construct_id": "CNSTR001",
      "term": "CEP",
      "register": "Operator",
      "verbatim_canon": {
        "text": "CEP",
        "evidence": "Not defined in source"
      },
      "interpretation": {
        "text": "A deterministic archival compiler pipeline.",
        "evidence": "[EVIDENCE: p.1]"
      },
      "fields": {
        "purpose": "[EVIDENCE: p.1]",
        "nonnegotiables": "Not defined in source"
      }
    }
  ]
}
